Test #,Build #,Category,Test Case,Expected Result,Actual Result,Repeatable?,Blocker?,Test Owner
0,10/20/24,Arena\Main Phase,"After Retiring a gaurdian that spot was left blank but a new gaurdian could not be hired. During battle phase if that blank spot was clicked animation to attack from the discard pile shows but could not attack, and could not switch to a different gaurdian to attack, had to end turn with still moves left, same for all future battle phasees.",Once gaurdian is descarted the spot is oppened up for a different gaurdian to be purchased.,There was an empty slot but game did not let me fill it with another gaurdian.,No,No,Tigran Manukyan
1,10/20/24,Arena\Main Phase,"""Weed strangler"" ability does not activate when only selecting 1 opponent. Even tho it says select ""Up to 2"" gaurdians, when 1 is slected no animation plays,  and selected gaurdian is not effected.",The ability works for selecting 1 gaurdian.,"No animation plays, and selected oponent is not effected.",Yes,No,Tigran Manukyan
2,10/20/24,Arena\Specian Abilities,"For guardians with special abilites, cool down does not work. But instead can be used every turn.",Gaurdians with limitations cannot use special ablities while in cooldown.,Gaurdians that are sposed to have a cooldown have no cooldown.,Yes,No,Tigran Manukyan
3,10/20/24,Arena\Battle,"With the opponent low on health. After all of the opponents Gaurdians are removed, but there is still a gaurdian that can attack, if the end turn is selected the game freezes. The animation to atack the opponent dirrectly shows but no gaurdian can be selected to attack. The timer is also frozen. Happens when opponent is very low on health.",The game ends turn without freezing.,The game freezes.,Yes,Yes,Tigran Manukyan
4,10/20/24,Arena\Draw,"After all cards are drawn, the AI will freeze at its ""draw"" phase since it has no cards to draw, and will not skip it. Had to wait until time runs out.",The AI skips its Draw phase when it has no cards to draw.,"The AI freezes and doesn't take any turns, have to wait until time runs out to continue.",Yes,No,Tigran Manukyan
5,10/20/24,Arean\Defeat Screen,"On defeat screen ""You will get them next time"" played twice overlappnig each other.",Sound only plays once.,Sound played twice.,Yes,No,Tigran Manukyan
6,10/20/24,Arena\Options,Sound modifications does not work.,Options menu to allow sond modifications.,Sound volumes did not change after modificatons.,Yes,No,Tigran Manukyan
7,10/20/24,Arena\Main Phase,After a while AI will no longer hire gaurdians.,AI continious hiring gaurdians and attacking.,"The AI doesn’t hire gaurdians, and if the user doesn’t attack game can go on for ever.",Yes,No,Tigran Manukyan
8,10/20/24,Arena\Draw,"After a lot cards have been drawn, cards get hidden off screen, or even under some of the UI, so they are not clickeble, or purchasable. Maybe have cards stack some way.","Cards don’t get hidden, and are clickable.",Cards were hidden and were not accessible.,Yes ,No,Tigran Manukyan